用户昵称,性别,评论内容,被回复用户,评论层级,用户当前等级,点赞数量,回复时间
十年老兵杰森,男,回复 @圆脸湖北分脸 :是的，所以说建议对他们使用皮带辩证法。,圆脸湖北分脸,二级评论,6,0,2024-11-06 09:43:35
以改名的力量脱非,保密,回复 @半只小瓜瓜 :真捐钱就好咯，反正人家回去继承家业，又不是霍霍社会，多两栋楼还改善教学环境，就怕这种给钱都给不到好地方的,圆脸湖北分脸,二级评论,5,0,2024-11-06 10:41:56
pinkalue,保密,虽然看上去有点阴谋论，但是也不能不防范这样的可能。,圆脸湖北分脸,二级评论,5,1,2024-11-06 15:19:16
圆脸湖北分脸,保密,"回复 @pinkalue :阴谋论？
马☁️这个东西最近这些年一直在我国的很多方面进行疯狂的作死试探，妄图改变很多东西！
搞蚂蚁金服，妄图染指金融！
搞湖畔大学，妄图染指政届！
搞所谓的数学竞赛，妄图干预高考！
又通过所谓的慈善！例如蚂蚁森林之类的东西给自己帖护身符，
你们看他的这一系列操作，像不像西方那些资本家的操作？
我觉得国家是时候应该找一些典型挂在路灯上，以警示这些人！
就像之前国家说保交房，各大房企一个个说没钱装死，拒不执行。把许皮带一抓往监狱里一关，这些房企一个个突然就有钱了！",圆脸湖北分脸,二级评论,5,26,2024-11-06 18:33:51
Jeff123123,保密,对头，凭什么一个阿里能决定高校招人了,圆脸湖北分脸,二级评论,6,6,2024-11-06 18:59:09
就是一只特立独行的猪,保密,回复 @圆脸湖北分脸 :只能说一切都是生意,圆脸湖北分脸,二级评论,4,1,2024-11-06 20:05:18
高考数学程伟他爹,保密,其实更本就没有成立的条件，察举制的关键在于推荐别人的人本身都是些大佬，有话语权，对于现在来说大佬也不太会将自己的孩子放在国内赛道，更不会选一个普通人去充当查举的排面而且如果真的是察举制是不会搞的这么明显的，因为这会激化社会矛盾，这本身是阿里为了竞赛增加关注度，未经任何查实就发布的人造天才的虚假营销,圆脸湖北分脸,二级评论,5,0,2024-11-07 10:34:57
pinkalue,保密,回复 @圆脸湖北分脸 :不要激动，我没说你说得不对,圆脸湖北分脸,二级评论,5,1,2024-11-07 11:41:56
圆脸湖北分脸,保密,回复 @高考数学程伟他爹 :懂不懂什么叫试探？哪有一上来就集中火力冲墙的？当阿里把这个所谓的竞赛搞成了权威之后，那么他就掌握了这个推举权，懂吗？,圆脸湖北分脸,二级评论,5,4,2024-11-07 12:33:27
好的zech,男,回复 @好的zech :另外，怀疑涉事学生进东北大学是黑幕的依据是，后来在东北大学举办的比赛中这几个学生也参加了，有人用摄像机对着这支队伍直播，在比赛最后一个小时有人起身去厕所，一段时间回来后马上过了一道比较难的题，然而比这题更简单的问题还有几道没解出来的，后来第三方出题人说他们在比赛前进行了临时换题，这些人做出来的题目正好是他们没来得及换的，最后他们拿到了银牌，并且这场的成绩没有取消。,圆脸湖北分脸,二级评论,6,2,2024-11-07 13:43:43
睡着的水shine,保密,回复 @十年老兵杰森 :狗大户不懂技术，但是他们懂技术[doge],圆脸湖北分脸,二级评论,5,0,2024-11-07 23:28:48
神谕之灵,保密,这逻辑……姜萍和他老师是出得起钱的圈儿里的吗？,圆脸湖北分脸,二级评论,4,0,2024-11-10 22:41:12
内蒙古深海大鱿鱼灬,保密,回复 @神谕之灵 :这只是一次试探明白吗 如果把姜萍成功推上去了 那帮人就会用舆论造势 大书特书 把自己搞成权威,圆脸湖北分脸,二级评论,5,1,2024-11-11 04:56:09
你在玩火火火火火火火,女,把人逼急了什么都做得出来，除了数学,,一级评论,5,39,2024-11-05 16:24:08
固推或液推,保密,哈哈哈哈,你在玩火火火火火火火,二级评论,6,1,2024-11-05 16:25:45
vfddkii,保密,确实，数学水平有就是有没有就是没有。造假要是能提高数学水平人类的科技树早就爆发到天际之外去了,你在玩火火火火火火火,二级评论,4,1,2024-11-05 16:49:07
渡鸦306347,保密,不会就是不会，再怎么急也没用[笑哭],你在玩火火火火火火火,二级评论,5,5,2024-11-05 16:54:19
爱宝贝哦51,保密,只会红温[doge_金箍],你在玩火火火火火火火,二级评论,5,2,2024-11-05 18:56:49
crheb,保密,不急，急也做不出来，我大学的时候做不出来就摆烂去打游戏了，反正最后也没挂我，我记得我那个学期最后应该是82昏[doge],你在玩火火火火火火火,二级评论,6,1,2024-11-05 20:41:52
刘昊航Richard,男,物理化学生物,你在玩火火火火火火火,二级评论,6,0,2024-11-09 08:36:29
意大利大喷菇,保密,[笑哭][笑哭],,一级评论,4,7,2024-11-08 06:23:36
悠闲剑士,保密,最搞笑的是都这样了还有人能嘴硬，就好像姜是什么精神支柱，崩塌了会四人一样[doge],,一级评论,6,10,2024-11-06 11:24:10
吉左人地哥猪猪,保密,"人可以在愤怒的情况下做出各种事情，但是唯独就是做不出数学题
尤其是高数，那就是修仙小说里的符文学，一个符号代表的公式和意思，之前没有学习过，根本不可能理解
高数作假的方式有很多，但是只有高手之间交流一番，基本就知道水平在哪了",,一级评论,6,1173,2024-11-05 16:43:23
BLAze-OP,男,回复 @wwbaozi : 二三十分这也太抽象了，英语选择题就算蒙也能蒙个四五十吧[笑哭],吉左人地哥猪猪,二级评论,5,0,2024-11-06 18:17:27
wwbaozi,保密,回复 @BLAze-OP :这么多年我们学校也就出了这一个奇葩，纯理科思维的那种，其他人至少都是正常的那种。。。。[笑哭],吉左人地哥猪猪,二级评论,6,0,2024-11-06 19:01:22
拉棉花的兔子哟,女,回复 @带宰宏图 :有些人是真的可能没什么英语天赋，我有个朋友数学基本都是140+的，但是英语就是不太行50左右，语文一般般90上下，也没有眼高手低死活不学英语，就是正常学，但是就是学不起来。最后学日语了，日语都考120+左右的，可能就是英语学不起来吧。,吉左人地哥猪猪,二级评论,5,2,2024-11-06 21:07:00
Thunderff,保密,回复 @带宰宏图 : 英语是需要机械性记忆的，有的人聪明过目不忘，但是大多数人就是需要平凡的积累，3500个单词背三四遍每天一个小时就没了，一个小时能做多少物理了,吉左人地哥猪猪,二级评论,4,0,2024-11-06 23:00:58
dooonk,男,别说高数，高中数学有些题目扫一眼就知道怎么做，有的人如果偷懒没做过的话瞪半天也想不出,吉左人地哥猪猪,二级评论,6,1,2024-11-07 22:40:55
吉左人地哥猪猪,保密,回复 @dooonk :初中还能看图写个解 高中已经微积分了嘛？,吉左人地哥猪猪,二级评论,6,0,2024-11-07 22:58:38
玩砸了哎,男,不矛盾，这水平已经比绝大多数大学生强了，数学一般的人连题都可能看不懂，更别说能交流出答案来。对比一下就知道天赋确实挺强的。,吉左人地哥猪猪,二级评论,5,0,2024-11-08 00:13:00
bili_551287281,保密,回复 @玩砸了哎 :你见过姜萍的月考成绩吗，有这水平的，根本不会考这么个成绩，别以为这些通告上的全是实话，只有结果是不得不说的实话。,吉左人地哥猪猪,二级评论,4,0,2024-11-08 00:54:46
I-want-water,保密,回复 @丨真真假假丨 :错了，我数学好，英语40,吉左人地哥猪猪,二级评论,5,0,2024-11-08 11:19:58
卡利贝尔永不朽,保密,确实，高数不是小学的脑筋急转弯和举一反三，哪怕再聪明，没认真系统地学过那就不可能会,吉左人地哥猪猪,二级评论,5,1,2024-11-08 13:11:27
异乡的捕风客,保密,回复 @银河星系太阳 :不一定，和我一样选文科，结果就是英语不好，文综不优秀，本科线还高[doge],吉左人地哥猪猪,二级评论,4,0,2024-11-14 03:50:06
胖妞来啦,保密,回复 @银河星系太阳 : [笑哭]这样的还是不少的，我就是1个，我当时还是5门150分的时候，我数理化语都低的也可以130高的数学化学基本140都是低分，但是我英语就是及格水平，但是说到底我还是自己的问题，最主要的还是懒不喜欢背而且是真不喜欢英语，但说实话我中考那会英语还是不错的，就是上了高中高一第一个学期换了3个老师，让我们班的英语水平普遍都低，我就是更低了，高三那年老师给我补习了一年也就将将高了10分过了100，,吉左人地哥猪猪,二级评论,5,1,2024-11-16 21:34:29
胖妞来啦,保密,回复 @窗外碧云斜 : 对，你这句话我真的认可，因为我自己就是这样的人，我高考还是5门150分的时代，那会我除了英语剩下的最低也有130，高的例如数学化学这样的140都算低的，但是我的英语就是不行，我自己都承认我就是懒的背单词，后来大学因为学位要英语4.6，那会我就没黑没夜的背，4.6级也都过啦，只能说高中那会英语还是没逼到那个份上。,吉左人地哥猪猪,二级评论,5,0,2024-11-16 21:37:39
青衫的百级大海螺,保密,回复 @丨真真假假丨 :数学特别好 会有学校专门联系的 即使这个人极端到数学150 其他科全0分 也会有很好的大学专门联系他,吉左人地哥猪猪,二级评论,5,0,2024-11-22 23:43:51
艾洛粒,男,哈哈哈还真是,吉左人地哥猪猪,二级评论,5,0,2024-11-23 14:55:56
艾洛粒,男,回复 @丨真真假假丨 :嗯，也不能这样说。你英语，语文不好，你数学好也是可以的。,吉左人地哥猪猪,二级评论,5,0,2024-11-23 14:56:38
锐刻五牢大,保密,愤怒时候可以做出来，但要有基础，我就是经常想不出开题后骂人咬牙，躺一会就出来了[笑哭][笑哭],吉左人地哥猪猪,二级评论,6,0,2024-11-24 09:13:13
同名的渣,男,回复 @带宰宏图 :语言能力和逻辑能力不能挂钩的,吉左人地哥猪猪,二级评论,6,0,2024-11-30 06:54:36
清若云兮,保密,回复 @丨真真假假丨 :理科思维都差不多,吉左人地哥猪猪,二级评论,4,0,2024-11-30 08:47:58
十里梦蝶,保密,回复 @带宰宏图 :我是数学物理分高，外语特别低，单纯背不下来那种[阴险],吉左人地哥猪猪,二级评论,5,0,2024-11-30 09:35:06
枫林tzr,男,回复 @丨真真假假丨 :不一定，本人高二，年级里就有总分不到四百数学140+的人[笑哭],吉左人地哥猪猪,二级评论,5,0,2024-11-30 14:05:04
_罗密欧与猪过夜_,保密,回复 @带宰宏图 :不是懒，就是单纯抵触文科[吃瓜]一直抵触也是一种勤奋,吉左人地哥猪猪,二级评论,6,0,2024-12-02 22:47:48
YY00745,保密,你说的那是一般的偏科，但她的数学可不是一般的好，是能进清北少年班远超同龄的那种好。这就需要她的头脑包括逻辑思维，抽象思维，自学能力，专注力理解力记忆力在内的所有学习能力都是顶尖。这样的孩子能被初中的语文英语难住，我是不信的。学神也会偏科，但那是对于同档次的，对普通人，她稍微花一点点时间都是碾压。除非她真的是很想早点出来打工，不然说不通的。,吉左人地哥猪猪,二级评论,5,0,2024-12-03 09:23:26
吉左人地哥猪猪,保密,回复 @YY00745 :网上的众说纷纭，有人说的数学不行，有人说的成绩本来就不咋地 你的说法来源是哪里啊,吉左人地哥猪猪,二级评论,6,0,2024-12-03 15:25:26
初晗碧天,保密,回复 @丨真真假假丨 :数学好，理综随便拿捏，语文和英语看心情[吃瓜][吃瓜]好多时候理综偏科并不是学不会语文英语，也不是记忆力不好，单纯是懒得去背，看不起死记硬背罢的叛逆罢了[笑哭],吉左人地哥猪猪,二级评论,5,0,2024-12-12 10:09:52
初晗碧天,保密,"回复 @拉棉花的兔子哟 :单纯懒得背，觉得费力不讨好而已，有那时间不如多玩一会。
语言天赋是指不系统学习光听和交流就能掌握一门学科，而我们所接触的英语语文学科并不需要这种天赋，只要肯背，背单词背诗句背文章，哪怕理解不了语法，搞不清楚文章背后用意，单纯靠背来理解试题也能轻松及格，因为文综试题逻辑也是很强的，并不都是考情商的[妙啊]",吉左人地哥猪猪,二级评论,5,0,2024-12-12 10:17:55
--止言,保密,回复 @丨真真假假丨 :偏科很正常吧,吉左人地哥猪猪,二级评论,6,0,2024-12-14 15:01:01
多啦金尧Peter,男,阿里集团发个声明交代完事了，啥处罚都没。王闰秋被谈个话取消评优，然后继续教他的书。只有姜萍，估计这辈子都没脸在学校读书，嫁人，也没有岗位会要她了,,一级评论,6,14,2024-11-06 16:28:00
风起昶林,保密,姜萍和她老师和阿里三方都有责任，题不是你自己做的你不清楚吗？你自己几斤几两你自己不清楚？不用扯什么姜萍没错。废话，三方都有错！,,一级评论,5,17,2024-11-05 17:15:10
向着光微笑前行,男,知耻近乎勇，还有救！,风起昶林,二级评论,4,0,2024-11-05 17:20:51
替天行道的土豆,保密,人急了什么事都做得出来，除了数学题,,一级评论,6,15,2024-11-06 16:43:35
万物皆有灵H,保密,央视也得反省下了，几次搞错了,,一级评论,5,153,2024-11-05 20:38:18
共产甜瓜,保密,我看到这件事的时候，心里想的就是，等结果，真的就佩服，假的也已经习惯，这么多年，这么多热搜被骗了不止一两次了也该长记性了[笑哭],,一级评论,5,81,2024-11-05 16:08:16
红色星海,保密,新闻学魅力时刻，不知道主=6的时候我还以为她真有两把刷子,共产甜瓜,二级评论,6,12,2024-11-05 16:14:35
Yilande,保密,没什么好等的，要么假要么黑幕，真不了一点,共产甜瓜,二级评论,6,1,2024-11-05 17:21:40
江南dxk,男,这种但凡受过高等教育的就知道假,共产甜瓜,二级评论,6,1,2024-11-05 18:52:19
blo62958,男,主要我数学也不好，听不懂，干脆先吃瓜，不发表态度。,共产甜瓜,二级评论,5,1,2024-11-05 22:02:48
绳斤小生姜,保密,就没关注过，就算是真的我也不想管，对我没什么好处，所以看到这个消息，一点都不意外[doge],,一级评论,5,89,2024-11-05 16:01:23
独孤至帅,保密,置身事外也是一种优秀的能力哈哈哈,绳斤小生姜,二级评论,5,12,2024-11-05 16:18:45
筱崎菔,保密,[doge]＋1，这事情太假了，糟点过多，我都懒得关注。,绳斤小生姜,二级评论,6,2,2024-11-05 21:59:27
-小衍-,保密,同感[doge_金箍],绳斤小生姜,二级评论,5,1,2024-11-08 18:45:25
大KER,男,我是tga小机器人得年度以后看他们评论区有人玩梗搜了才知道还有这么号人物的[doge],绳斤小生姜,二级评论,6,0,2024-12-15 09:18:21
秀骨清像陆探微,保密,“中专”和文化课“天才”在一起我感觉就挺奇怪的[笑哭],,一级评论,6,9,2024-11-05 17:48:07
克洛-琳德,保密,这个新闻太爆款了，那时火了很久，我当时很怀疑是为了拿中专学霸这个事情来掩盖另一个劲爆的消息（丑闻）这样好吸引绝大多数人的目光，但当时我找了其他几个软件的热搜，好像并没有找到,,一级评论,5,33,2024-11-09 08:17:47
shaben007,保密,有极大可能是有专门部门做这个事的，我之前特意关注过好几次。,克洛-琳德,二级评论,6,2,2024-11-10 09:12:54
1970日,保密,资本有力量,克洛-琳德,二级评论,2,2,2024-11-12 00:04:48
西窗杂库,保密,也可能是有利益相关的故意带这个热度，来增加这个竞赛的名气吧。反正这事之前我是不知道还有这个竞赛的,克洛-琳德,二级评论,6,2,2024-11-14 23:19:20
道晚安同志,男,哪件事,克洛-琳德,二级评论,5,0,2024-11-16 12:40:20
克洛-琳德,保密,就是这个竞赛的事情,克洛-琳德,二级评论,5,0,2024-11-16 12:48:47
姬漩月,女,这种暴一个雷挽救上一个雷的是娱乐圈常用的,克洛-琳德,二级评论,6,1,2024-11-22 11:49:54
蓝色日记1126,男,阿里负责人恶意造谣炒作社会事件，攻击教育制度，暗藏私货，抓起来行政拘留一周。,,一级评论,5,13,2024-11-05 18:46:35
嘻嘶超凶,保密,好歹大家都是应试教育挤出来的，你说数学成绩不好不代表一定没有能力这个多少有些道理，但你说数学成绩不好但是数学竞赛却是天才，多少是低估了应试教育出来的人的智商吧[滑稽],,一级评论,6,40,2024-11-05 16:44:23
反幼战线,男,别人都能说，你能说吗？合订本女士？,,一级评论,5,6,2024-11-25 18:43:38
账号已注销,保密,太好了，我们理工科学子当时在网上可是人人喊打说我们嫉妒她呢…真是讲都讲不赢，还拿什么名门正派妒忌打压来说事，白眼都要翻出来了[疑惑],,一级评论,0,17,2024-11-05 20:04:45
探封赤子,男,还“学历歧视”嘞，笑死我了,账号已注销,二级评论,6,4,2024-11-06 00:27:21
账号已注销,保密,回复 @探封赤子 :被歧视疯了，中专最最最高贵了,账号已注销,二级评论,0,5,2024-11-06 01:41:13
桥豆玛奈,保密,回复 @探封赤子 :不用气馁，前面忘了，总之好的985211不比中专差,账号已注销,二级评论,5,6,2024-11-08 10:05:56
账号已注销,保密,回复 @桥豆玛奈 :干巴爹！我们要努力升中专鸭[脱单doge],账号已注销,二级评论,0,2,2024-11-21 22:29:55
想笑啊111,保密,烫知识，在东大这种教育体系下，最不可能被埋没的就是数学人才,,一级评论,3,20,2024-11-10 19:22:22
sss651,保密,阿里一直是这样的调性，一直在寻求突破国内现有规则，想把美国察举制、资本制的内容带进来,,一级评论,5,10,2024-11-06 09:12:02
索多玛的大帅哥,男,湖畔大学不甘的挣扎[doge_金箍],,一级评论,6,71,2024-11-05 16:33:53
羽_夜,男,看到中专生数学全球12名就没信过，哪有这种跨度一步登天的，还是数学这种学科。真天才也不会上中专了。会信的我只会觉得连高中都没上过，对数学没一点概念。,,一级评论,5,18,2024-11-05 19:20:01
长路迢迢不知归期,保密,搞个一眼假的事情来考验别人的智商呢[吃瓜] 好在我们的义务教育普及的比较好，放老美那里估计事情已经办成了,,一级评论,6,7,2024-11-05 16:21:05
Hayate疾風,男,当媒体被打脸后，这两天连续选择是提出网暴那个染发妹和誓师女，呼吁不要网暴，而不是承认自己的错误。,,一级评论,6,10,2024-11-07 10:46:30
叫我杨过啊,保密,这些媒体是真的恶心，那时候疯狂捧，现在又疯狂踩。姜的事情也就是考试作弊而已，根本没多大影响，都是这群吃人血馒头的,Hayate疾風,二级评论,5,0,2024-11-07 10:50:45
生吃pink,保密,帮助 不就是作弊吗阿里说的那么好听,,一级评论,6,6,2024-11-06 10:40:42
血眼的伊万,男,"数学领域确实有天才，但是数学的天才不会在中专才被发现。[偷笑]
有人笑我对社会认识太浅，我笑他对数学知道的太少。[喜极而泣]",,一级评论,6,19,2024-11-06 10:12:32
本座掐指一算,保密,但凡有独立思考能力的人都不会相信的，真是数学天才在现在的应试教育制度下绝对不可能去读中专,,一级评论,6,8,2024-11-05 16:38:16
夏夜_流萤_飞花,保密,能信中专仔超越一群数学专业硕士博士的人这辈子都有了，懒得评价，没有争吵的价值。,,一级评论,6,24,2024-11-05 16:52:42
明霞升洋,保密,央视站台，是为了让更多人上中专。假就假呗，反正那一波宣传过了。考不上本科的还是去上中专or大专,,一级评论,6,8,2024-11-14 10:20:08
兔兔和大海,男,正解,明霞升洋,二级评论,5,1,2024-11-14 10:25:34
_全糖去冰_,女,为什么总有人想不明白呢，在应试教育背景下，🇨🇳可能会埋没贝多芬和毕加索，但绝不可能埋没一个华罗庚，数学真有天分的话中考数学卷考个满分还是简简单单的吧，能去中专？[捂脸],,一级评论,5,14,2024-11-06 10:30:14
阿永永哥,男,老师跟她是什么关系？为什么要冒风险去帮她？,,一级评论,6,38,2024-11-05 18:55:38
大唐诗人握持,男,我还以为是在利用她,阿永永哥,二级评论,6,4,2024-11-05 18:56:18
萌萌小喵咪,保密,"这垃圾比赛由于是全球的 所以不是统一时间作答 ，是在一定时间范围呢，你去考就行。
他老师先做完题了，已经知道了题目 后面又用姜萍的身份去提交了一份答案。
就这么简单。",阿永永哥,二级评论,6,24,2024-11-05 19:02:43
逍遥没洗脸,保密,自己的学生出息了，自己名声也能提升，可能是单纯的利用,阿永永哥,二级评论,6,13,2024-11-05 19:04:42
账号已注销,保密,带学生拿奖，指导老师当然有荣誉了,阿永永哥,二级评论,0,18,2024-11-05 20:08:44
我把名字给改了,保密,"回复 @大唐诗人握持 : 老师要读博
搞这个当跳板加分",阿永永哥,二级评论,4,14,2024-11-05 21:15:31
我叫孙烎旺,保密,这个比赛是参赛就可以看到题目，答题时间8小时。他等于给姜报名就可以提前看到题目，多N个小时去做题，而且这不是他第一次这么做了，之前一次跟他女朋友同分过的预赛。,阿永永哥,二级评论,6,9,2024-11-05 22:44:32
Minigh,保密,姓王的老师好像就是这类培训机构的,阿永永哥,二级评论,6,0,2024-11-05 23:03:57
小真真诩,保密,老师只是用她的信息多开个号来给自己提高胜率罢了。被盯上炒作迫于压力只能陪着疯，你看采访的时候老王紧张得抖个不停。如果没有炒作，这事对姜一点影响都没有。至于那么多学生为什么恰好用了姜的信息，就不知道了。,阿永永哥,二级评论,6,17,2024-11-05 23:25:24
小真真诩,保密,回复 @逍遥没洗脸 : 老王可没傻到认为中专教得到这个水平。纯粹是阿里和塔的炒作把他绑上车罢了。这也是老王紧张得抖的原因。,阿永永哥,二级评论,6,14,2024-11-05 23:27:17
邂逅一场幻境,保密,类似一个枪手组织，里面数学各领域的都有，枪手在学术界还是有不少的，这类人不少都是平时就有工作的，搞这个来赚外快。也有专职枪手，这种就比较专业了。现在这个王某某名声还真给他打响了。,阿永永哥,二级评论,5,2,2024-11-06 00:26:54
い赫斯缇雅ぐ,保密,[大笑]怎么还有人信这玩意？题就是王答的懂不懂，用了三个号 ，姜萍号分最高,阿永永哥,二级评论,6,6,2024-11-06 10:19:42
闰土Mr,男,不是帮她，最开始就是老师借姜萍身份证参赛，老师夫妻两张身份证+姜萍身份证，三个号一块搏一搏，只是阿里看身份证，一个小姑娘杀出来了，马上做新闻，都不算老师代打，是老师借号上分，一波采访把姜萍架住了，估计一商量就认下了,阿永永哥,二级评论,5,4,2024-11-06 19:11:51
想沉迷学习的混子,男,不是老师帮她，是老师用她的名义去考的，之前就有人发现那个老师和他的妻子也参加了这个比赛。不过后面得了名次太好了只能让当事人出来圆谎了，再加上草根逆袭的剧本都往往有很大流量就一堆人推。我敢说如果今年姜萍这个事情没有意外，明年优秀新青年代表就必有她,阿永永哥,二级评论,6,1,2024-11-07 09:29:27
QBZ-191贴身护卫,男,回复 @大唐诗人握持 :确实是利用她,阿永永哥,二级评论,5,0,2024-11-07 15:40:59
小丑就是你_,保密,回复 @大唐诗人握持 :也算是利用啊，她天才的名声打出去了，老师作为发掘“千里马”的“伯乐”，他在学术界的获益远比你想象的多哦,阿永永哥,二级评论,3,1,2024-11-07 19:19:10
IIlllIIlI,男,其实是用她的号做题多点时间罢了,阿永永哥,二级评论,5,0,2024-11-08 16:54:22
虎虎成风,保密,她老师在办培训班，当宣传呀,阿永永哥,二级评论,6,0,2024-11-13 11:11:10
REDEEMER2000,保密,回复 @盖浇饭就是最棒的 : 不是，是想要多个账号多次机会刷成绩，因为比赛不是实名，到时候哪个账号排名靠前就用这个账号继续比赛，但是中专生没有那个脑子，以为借用了自己名义的荣誉就是自己的，擅自接受了媒体采访,阿永永哥,二级评论,6,2,2024-11-16 16:57:51
账号已注销,保密,对我知道，但是前面有人问，我只是回答他的问题哈，即使是指导学生拿了奖他也有利可图的。,阿永永哥,二级评论,0,0,2024-11-16 19:08:27
邻家小小酥,保密,老师拿她的账号刷题,阿永永哥,二级评论,5,0,2024-11-17 09:00:54
禁止达咩,女,[微笑],,一级评论,5,5,2024-11-06 09:20:47
爱看小说的黄焖鸡,保密,&#34;我除了吃饭睡觉都在做题👍，平时做的那些作业，我扫一眼👀，我觉得没有什么做的价值🤓👆，我更偏向于做  高  等  数  学  之类的，它会给我带来  探  索  的欲望，我喜欢一步一步证明，得到我想证明的东西👉，无论未来会怎么样，数学这个兴趣爱好一直会持续下去🤓☝️&#34;,,一级评论,3,184,2024-11-05 19:07:41
﹎Flyˇ、,男,已收录至冥人冥言[大笑],爱看小说的黄焖鸡,二级评论,6,24,2024-11-05 19:39:03
数学家凤,男,厉害，扫一眼就知道了,爱看小说的黄焖鸡,二级评论,5,5,2024-11-10 19:47:01
