用户昵称,性别,评论内容,被回复用户,评论层级,用户当前等级,点赞数量,回复时间
晴朗丶无云,保密,数学不讲平等也不讲政治，勤奋、天赋缺一不可,,一级评论,6,0,2024-11-05 17:08:48
漪笑,女,这本质上就是一种学术造假，还有一堆人洗地说“她能做出来她已经很厉害了，你上你行吗？”行不行都不能学术作假，她侵害的了其他人的权利，如果学术造假成功了，就会把本属于别人的机会剥夺了，而被剥夺机会的是其他认认真真学习的中专生。很不能理解那些为她说话的其他中专生，什么脑回路，明明在害他们自己，却还要为她学术造假得来的初赛荣誉洗地。,,一级评论,6,0,2024-11-05 16:53:50
胖嘟嘟的理查德,保密,"多么希望能是真的！！！
（讨厌阿里巴巴是有原因的）",,一级评论,4,0,2024-11-05 16:53:22
冷阿辰lcz,男,金蝉子说话！,,一级评论,5,0,2024-11-05 16:51:35
暗和哎夜,男,我依然认为这件事影响这么坏，主要责任在阿里，和不负责任的媒体！还有那个老师，姜平一个人一个中专生她何德何能把事情搞这么大？,,一级评论,6,0,2024-11-05 16:50:34
真的爱吃樱桃的祺祺,保密,“时间是检验真理的唯一标准”,,一级评论,4,0,2024-11-05 16:35:23
琴聲繾綣時光,保密,本来就是一眼假的事儿，看到到处吹我是真的麻了，而且你还不能质疑，不然就是酸,,一级评论,6,0,2024-11-05 16:34:38
杦杦安安,保密,我觉得不好苛责一个未成年孩子，不管她是不是“天才少女”，那新闻也是被成年人推出来的，让这个事件淡化吧，她的名字和模样不合适出现在各大媒体的报道中。,,一级评论,6,0,2024-11-05 16:36:23
mufas,男,老师帮我我也做不到她做那些,,一级评论,6,0,2024-11-05 16:32:24
丰血厉害,男,没有第二轮赛吗。？,,一级评论,6,0,2024-11-05 16:30:00
赤备重吉,保密,乐,,一级评论,4,0,2024-11-05 16:26:12
scarmoonz,保密,"“没打中？”
“让子弹飞一会儿！”[吃瓜]",,一级评论,6,0,2024-11-05 16:23:39
我才真困啊,男,我个人对多个专业领域都有一定了解，其实很明白，非科班出身和科班出身的，有着本质的区别。但心底还是愿意相信，或者说希望看到，有这种非科班出身的天才。遗憾的是，自欺欺人了。,,一级评论,5,0,2024-11-05 16:23:04
黑子的篮板,保密,我就说嘛 中专生要是数学能得第一 根本不可能考不上大学,,一级评论,5,0,2024-11-05 16:17:55
爱仕达时代,保密,公共理性认知 是不是简称公知？,,一级评论,5,0,2024-11-05 16:16:15
MXZ_DSB,保密,上帝定理 主＝6,,一级评论,3,0,2024-11-05 16:13:00
哏都钢铁侠,男,毫不意外,,一级评论,6,0,2024-11-05 16:08:36
爹爹在此孩儿休走,保密,[doge]赶紧直播带货,,一级评论,5,0,2024-11-05 16:06:40
提里奥丶陈,男,害人害己[笑哭],,一级评论,6,0,2024-11-05 16:00:24
悠闲悠哉的我,男,[初音未来_干杯],,一级评论,6,0,2024-11-05 15:59:18
屠龙的b友,保密,数学哪怕你从小学到高一次次满分都只能叫数学人才而不是数学天才，数学天才唯一有可能被遗漏的原因是身体发育较慢，前面天赋一般般后面身体发育期间脑力暴涨，弯道超车成为天才,,一级评论,4,0,2024-11-07 22:33:16
明月清风丶凉,男,数学好的，至少理综都不差，语文英语只要不是自己不想学，按照老师的要求背诵刷题，高中绝对有的读,,一级评论,4,0,2024-11-07 21:13:30
猫猫卡密撒嘛,男,之前信的还蛮多的，专业内客观质疑一下都被围着喷。。。。。,,一级评论,6,0,2024-11-07 18:08:51
行骥,男,🤣,,一级评论,5,0,2024-11-07 17:48:41
ygushbd,保密,王闰秋能拿到这个名次也挺猛的[支持],,一级评论,5,0,2024-11-07 16:16:11
龙华妃咲的狗,保密,任何学科都有靠努力弥补天赋不足的可能，唯独数学除外。这是我高中不断刷题的时候就明白的事,,一级评论,5,0,2024-11-07 15:07:48
嘿咻颜,保密,努力也是一种天赋，准确的说，越是小时候，努力以外的天赋就会越醒目，得等到长大，努力才会有显著作用,龙华妃咲的狗,二级评论,5,0,2024-11-07 15:23:01
leader万,男,什么科目都可能超出应试教育出天才，但是理科，会就是会，不会就是不会，中专的学生就是不可能在理科上超越大学生乃至高中生,,一级评论,6,0,2024-11-07 10:35:33
编曲学渣哥,保密,本来就是开卷考试，一点含金量都没有，偏偏要炒作,,一级评论,5,0,2024-11-07 10:34:12
编曲学渣哥,保密,首先，每次考试题目都是一样的，只要把题目截图，然后查答案，或者自己思考很久，用另一个账号再考一次，就算只是普通水平，也能入围啊，只是大家不关注这个事而已，不要动不动就天才,,一级评论,5,0,2024-11-07 10:32:08
遥远的救世主与理想乡,保密,智商高的人不可能学历很低,,一级评论,6,0,2024-11-07 10:29:20
遥远的救世主与理想乡,保密,智商高的人不可能学历很低，学历是智商的具象话,,一级评论,6,0,2024-11-07 10:29:46
青vvv山,男,中专和天才是怎么联系在一起的？,,一级评论,5,0,2024-11-07 10:01:51
沐锅锅丫,保密,初中那会一元二次方程，少上两三节课，不想办法补回来，后面的课就学不懂了。,,一级评论,5,0,2024-11-07 09:37:35
評论不存在,保密,什么帮助，就是作弊,,一级评论,6,0,2024-11-07 09:11:26
库克船长2024,保密,我只是觉得姜萍可怜。,,一级评论,5,0,2024-11-07 09:02:36
Ciaran_Greed,男,并不无辜，可以选择不接受采访甚至退赛，能有勇气对着全国人民撒谎，也算是个人才了,库克船长2024,二级评论,6,0,2024-11-07 19:05:53
飞翔的博文,男,"这就是达摩院自己策划的戏吧，不然怎么唯独姜萍爆火又是采访又是炒作啥的，我记得名单里不仅有她，还有家里蹲大学和百里玄策佚名等人，大家都没咋正视这个比赛，本来没多少人参加的比赛它一营销就是全球排名...
也许姜萍的成绩是否真实达摩院压根不关心，它要的就是讨论度，咱们吵得越凶这个所谓全球比赛就越出名，现在名声拿到了它再澄清事实把姜萍踢开挽回信誉，带着名气美美隐身，骂名全部由姜萍承担",,一级评论,5,0,2024-11-07 08:50:28
飞翔的博文,男,我觉得这比赛本来就没啥权威，也非官方，姜萍刚开始只是以为自己给老师提供个无关紧要的账号，谁能料到达摩院的人扛着长枪大炮就冲到她学校采访她，她用不能对着人说自己你这比赛没啥权威所以我把账号借出去了，所以她只能硬着头皮承认，结果一步错步步错，火势越烧越大终于烧到她身上,飞翔的博文,二级评论,5,0,2024-11-07 08:56:19
bili_86919900445,保密,真是可惜，是因为少了一个人才可惜。,,一级评论,2,0,2024-11-07 08:37:50
虹夏波奇凉喜多惠惠,保密,之前还真有人信？除了小红书的某些人一般不都当个乐子吗,,一级评论,5,0,2024-11-07 08:19:56
最新幻想X,保密,都没上过九年义务教育吗？有没数学天分，三四年级就能看出来了,,一级评论,6,0,2024-11-07 08:10:52
issacjx,男,现在还有什么是真实可信的吗,,一级评论,5,0,2024-11-07 08:00:28
两只羊LY,保密,前两天刚爆出来的时候还看到有人说前两天考试还拿她举例子我真绷不住了[笑哭][笑哭],,一级评论,5,0,2024-11-07 07:20:23
东海一朝鲜,男,现在社会，人才埋没的可能性不是没有，但几率很小了，而且当时带来的流量巨大，全网炒作却没有一个女孩本人的采访视频，我就猜肯定有乌龙，现在明显是被人利用了，留下一地鸡毛，,,一级评论,4,0,2024-11-07 04:56:39
暗时间又又又,女,姜萍出来道个歉还是很容易被原谅的，年纪小不懂事都能理解，如果躲着不出来，掩耳盗铃，那就是故意愚弄大众了，也别怪大家谴责你,,一级评论,5,0,2024-11-07 01:10:50
猫忘不了鱼尾鲨,保密,[坎公骑冠剑_吃鸡],,一级评论,5,0,2024-11-06 23:42:55
约拿单和大卫得偿所愿,女,最开始一堆人用她踩那个名单里在她后面的名校学生[笑哭]嘲讽人家接受最顶尖的教育资源还考不过她，🍋得我胃都疼了，看出来了，一堆不爱学习或者学了也学不好的妒男妒妇对成绩好的人天然而纯粹的敌意喔～,,一级评论,6,0,2024-11-06 22:52:43
啊長川,保密,那也没办法，一堆人等着新闻挣钱和业绩，管他是不是真的，先曝光，，流量有了就起来了呗，姜萍也有错吧，不接受采访就没那么多事了。,,一级评论,5,0,2024-11-06 19:21:56
快给Cynthia打钱,保密,[哦呼]我只是单纯的觉得专科的学生上的课比较水，然后她用很多很多事时间都拿来研究数学，不会像我们有些大学生一样一周三十多节课，一周七天早八一样。原来还是假的。。。但是我觉得普普通通的人一天学12个小时数学坚持1年初赛应该也能过吧[哦呼],,一级评论,4,0,2024-11-06 19:13:22
吉影特摄,男,是他自己想这么做还是沦为了资本的工具，这值得思考？[脱单doge][脱单doge][脱单doge],,一级评论,4,0,2024-11-06 16:35:14
遮沙避风类,保密,漫长的8月终于结束了,,一级评论,3,0,2024-11-06 16:31:49
柠檬红茶坊主,女,嗯……第一次看到这个新闻也挺羡慕她的……还想着希望能见她一面呢[笑哭],,一级评论,5,0,2024-11-06 16:27:00
小罗罗呆美,男,一莎还会发话吗？[doge_金箍],,一级评论,5,0,2024-11-06 14:53:20
烧烤橄榄树,保密,数学[doge]不会就是不会[OK],,一级评论,6,0,2024-11-06 13:55:10
月亮是爱意的密语,女,主=6 哈，笑死，永远忘不了,,一级评论,5,0,2024-11-06 13:53:11
大概是海豹,保密,你们对数学的看法太对了，我喜欢T字母。,,一级评论,2,0,2024-11-06 13:37:43
已知老米,保密,我作为数学老师都差点信了！,,一级评论,5,0,2024-11-06 13:05:01
是晚辞y,保密,天才+中专=[滑稽],,一级评论,3,0,2024-11-06 13:04:23
bf20021225,保密,阿里害人不浅,,一级评论,6,0,2024-11-06 10:50:30
MagiLi,保密,谁都会骗你，数学不会。不会就是不会[OK],,一级评论,4,0,2024-11-06 10:42:18
勿忘初心lovelove,男,等什么，笑啊！哈哈哈哈,,一级评论,6,0,2024-11-06 10:27:12
淘宝用户404,保密,乌龙茶,,一级评论,6,0,2024-11-06 10:23:13
金克拉教授,保密,啊，ri 屙（12）啊[doge],,一级评论,6,0,2024-11-06 10:18:39
蜻竹蜂云剑,保密,"不会是反向炒作吧？主办方的资本背景才让人怀疑它们自己在利用这事给自己抬轿子提高其在某些领域的某种特殊地位。
至于事件焦点里的学生或者老师，这类主体在我们如此广阔的土地上可绝不是凤毛麟角般存在的，事件虽然是真实的，但关于他们的这种叙事即使不出现在这个事件里也不排除会在其他故事场景里成为普通大众关注的对象。",,一级评论,3,0,2024-11-06 09:56:17
萌新新629,男,中专跟老师谈恋爱都显得正常 比赛这成绩太扯了[doge],,一级评论,6,0,2024-11-06 09:44:18
两条弧,保密,中专，天才，数学，乐死我了，但凡数学非常好的，自我认知还是清醒的，不会说堕落到去中专，就算去也是去那种开设高考班的中专，看到这个妹子的事情一眼看出作秀[笑哭],,一级评论,5,0,2024-11-06 09:23:30
项阳项洋,保密,学新闻是这样的,,一级评论,6,0,2024-11-06 09:01:56
汀ning,保密,卷子大部分是姜萍做的，老师只是提供了帮助而已。,,一级评论,5,0,2024-11-06 08:35:01
敛纸鸢,女,玩原玩的,汀ning,二级评论,6,3,2024-11-06 08:42:20
抽象拱火乐子人,保密,卷子大部分都是老师做的，姜萍只是写上了答案而已[偷笑],汀ning,二级评论,4,1,2024-11-06 08:43:08
狗头鹦,保密,那个爆改啦,汀ning,二级评论,4,0,2024-11-06 14:51:35
辰季塔尔,男,又纯又沙,汀ning,二级评论,5,0,2024-11-06 17:26:51
神说的要有光啊,保密,当初看就觉得不可能，中考数学和平时考试数学天才不拿满分都难，她那个分数，数学这玩意儿吧学过的都知道天才很难被埋没，不会的就是不会的,,一级评论,5,0,2024-11-06 08:22:49
超级阿荣,保密,是这样的，所有人只需要等结果就好了，而jp要考虑的就很多了，比如怎么继续蒙骗世界之类的,,一级评论,5,0,2024-11-06 08:07:20
弯弯犬,保密,中专，天才？让我们说中文,,一级评论,6,0,2024-11-06 07:48:44
pinkalue,保密,之前很多人说这个中专的分数线并不低，是真的吗？,,一级评论,5,0,2024-11-06 07:48:17
零碎的绪,男,在淮安普高线已经够低了只能说初中正常学的都能上高中,pinkalue,二级评论,4,0,2024-11-06 07:52:09
真Dennis,男,主不再等于6，天塌了[doge],,一级评论,5,0,2024-11-06 07:41:13
zxasd005,保密,当时我看到新闻第一反应是又造神？,,一级评论,5,0,2024-11-06 06:53:51
garyBiBiBii,保密,婵姐的视频都关注，唯独这个视频，是我最不关注的她的视频，事件本身是什么样的根本毋庸置疑，没有乐子，也没有悬念和矛盾，没看头,,一级评论,4,0,2024-11-06 05:27:59
炫酷丿成盒子,男,让我一时想起了高中同学英语148，数学9分的偏材！也有数学150，英语30几的大神[doge_金箍],,一级评论,5,0,2024-11-06 04:19:50
二次元中二少女,女,对于我这种数学只能拿基础分高中徘徊在一百到一百二十中间的人来说，数学很好的人真的很闪耀，这点我还是比较敏感的，你数学如果真的很好，其他有关联的也不至于差到哪儿去，而且非常容易受到关注，尤其是每次考试发成绩的时候,,一级评论,6,0,2024-11-06 03:36:28
剑馨水月绫,保密,比起过去，事件中很多人比过去都要理性，不乏一些年纪大的人，质疑者分为两部分，一部分从专业角度分析，这些题目还与物理有关，没有良好的高中物理成绩，根本做不出来，另一部分从生活常识判断，普通工薪阶层的孩子所学到的东西是最基本的，那些与考试关联性较大的训练方法、题目类型，有心人才能得到，得到了，你还得勤学苦练，一个没有搞定苏教版小学数学的家庭，高中都念不上，不要想其它，王某某毕业的江苏大学，其无锡校区的原学校是什么，懂的都懂，又不是天津大学，财会中专改成的大学，能有什么高手？现在开始鼓吹姜萍受害者论了，外貌比她漂亮，成绩比她好的，那么多人，为什么唯独是她被选中了？,,一级评论,5,0,2024-11-06 02:16:50
Herr_Sam,男,我能问问为什么这次视频这么短吗？[向晚_大头]别的视频往往能由点及面说很多啊，怎么这次甚至连过程都是简略的？我该不会在看一个的公知吧？[向晚_大头],,一级评论,6,0,2024-11-06 02:13:54
爱丽丝卡塔雷特我之嫁,保密,你看的是ai,Herr_Sam,二级评论,2,0,2024-11-06 12:06:05
嵌纱,保密,因为她一开始就是站姜萍的，现在急着反转自然稿子没写多少[吃瓜],Herr_Sam,二级评论,6,2,2024-11-06 13:00:08
EinhornN7獬羽柏,男,"一点意外都没有，当初就知道绝对是作弊的。
数学及格的都不会在专科，这学科就是用来筛智力不够的去当工人。
而且，数学不会就是不会，装不了一点假，就算你中考被分配到了设施稀烂环境特别差的学校考场靠作弊捞分，
你高中就能过的了高考的关么？？？？",,一级评论,4,0,2024-11-06 02:09:16
井中观天客,男,"难
人的认知 始终是有边界的
而有心炒作的，可以不断利用认知边界外 新的事物去做炒作 ...
所以 不断学习 提高个人自己的认知和修养是很重要的",,一级评论,5,0,2024-11-06 00:56:19
橙子们尸横遍野,保密,这么牛,,一级评论,6,0,2024-11-06 00:48:46
真-大肥猫,女,一个老师要学生注册一个账号方便他组团答卷，学生会拒绝吗？能拒绝吗？,,一级评论,6,0,2024-11-06 00:46:19
今晚也要准时睡觉,保密,一个学生，采访会拒绝吗，能拒绝吗[doge_金箍],真-大肥猫,二级评论,6,0,2024-11-06 00:48:18
国思i,男,在镜头前大言不惭的时候拒绝了嘛？能拒绝吗？,真-大肥猫,二级评论,6,0,2024-11-06 00:49:49
-正在缓冲---,男,老师拿枪顶着你的头让你配合的？,真-大肥猫,二级评论,5,0,2024-11-06 04:55:41
抗元英雄,男,有没有省流，太长不看，我只知道前一阵子突然一堆人捧，后一阵子一堆人嘲，怎么个事啊到底[哦呼],,一级评论,5,0,2024-11-06 00:38:54
打回原形123,男,数学比赛尖子是中专生 当初第一次看到就不信 谁的数学好跑去读中专职高  数学是不存在高手在民间这一说法的 不会就是不会[OK],,一级评论,6,0,2024-11-06 00:22:18
Allforlove,男,看到阿里赞助的，我就不看下去了,,一级评论,6,0,2024-11-06 00:04:53
makelose,保密,性质恶劣，应予严惩。,,一级评论,6,0,2024-11-06 00:02:14
天天天紫紫紫,保密,作弊啊，难怪,,一级评论,5,0,2024-11-05 23:41:35
胖虎猫铲屎,保密,中专数学是不是相当于初一初二水平[哦呼]？,,一级评论,5,0,2024-11-05 23:42:48
芙宁娜是我本命,女,大家没必要苛责姜萍同学，作为主办方应该要保护参赛者的个人信息而不是过分炒作，任由事情发展。,,一级评论,5,0,2024-11-05 23:37:24
肉煮骨烹表裏一体,保密,"数学是宇宙的公理。  宇宙，哪怕是黑洞的存在都建立在数学的基础上。 没有数学物理，宇宙都将不存在。 
你可以欺骗全人类。你欺骗不了数学。",,一级评论,6,0,2024-11-05 23:09:43
肉煮骨烹表裏一体,保密,作弊，作弊，作弊，作弊，作弊，作弊，作弊，作弊，作弊，作弊。女,,一级评论,6,0,2024-11-05 23:07:27
小菜一碟的菜菜,保密,愿望是美好的，现实是骨感的。就是不明白为什么那么多人都不允许别人合理质疑奇怪的事情。,,一级评论,4,0,2024-11-05 22:00:05
鹿我仙踪,保密,我觉得最有妖的是从学历争议居然上升到性别争议，非要说质疑的人是在质疑优秀女性……我当时就觉得这个舆论逐渐离谱。,,一级评论,5,0,2024-11-05 21:54:50
理熠夏,保密,阿里撇的挺干净,,一级评论,5,0,2024-11-05 21:46:50
吖光,男,数学天才和中专两个搭不上边的东西也有人信？你说她是炒菜天才还能信一下,,一级评论,6,0,2024-11-05 21:04:29
bili_10651490,保密,数学，不会就是不会。加什么身份buff也没用[doge],,一级评论,6,0,2024-11-05 20:46:53
枫茗苏糖,男,不管你是什么学历，什么身份，哪怕你的性别是正定矩阵，数学定理就是数学定理，会就是会不会就是不会[兔年][吃瓜],bili_10651490,二级评论,6,0,2024-11-05 21:47:36
牟一焜,男,"还是那句话，假的无论投入多少精力财产都不会变成真的。
人急了什么都会做，唯一不会做的只有自己不会的数学题。",,一级评论,5,0,2024-11-05 20:25:41
极道修仙者,男,[大笑][大笑][大笑]当时看到有个博主分析说这个小姑娘是为了帮助他老师评选的无奈之举，这下好了，两个人全完了,,一级评论,5,0,2024-11-05 20:12:23
时见夜,女,我还真信了[尴尬],,一级评论,6,0,2024-11-05 20:11:48
疾风阁,男,这个事儿我从一开始就有所怀疑，因为一个数学学的很牛逼的人，物理、化学等其他理工科目也绝对差不到哪儿去，语文跟英语就算随便答上点好歹也能混个大专吧。但是当时她被全网狂吹的时候我只能隐忍不言，毕竟万一真有这种超级偏科生咱也不能说人家啥。直到现在水落石出，真相大白。我只能说，你可以在一段时间内骗过所有的人，也可以永远的骗过一部分的人，但你绝对不可能永远的骗过所有的人。,,一级评论,6,0,2024-11-05 20:13:22
清风道别,男,阿里巴巴赢嘛了,,一级评论,5,0,2024-11-05 20:12:49
小真真诩,保密,阿里的比赛算是废了。,清风道别,二级评论,6,0,2024-11-05 23:11:37
清风道别,男,回复 @小真真诩 :得到了宣传,清风道别,二级评论,5,0,2024-11-06 02:13:55
疾风阁,男,"经济、文学、财经你如果不会，那你稍微看点书也能装出一副会的样子。
但是数理化生等等理工学科，你会就是会，不会就是不会，短期内再怎么临时抱佛脚都是白搭。因为这些都是系统性的学科，就跟一个串联电路一样，中间但凡有一处断点整个电路就是报废的。
所以说，纸是包不住火的，该原形毕露的时候你是躲不过的。",,一级评论,6,0,2024-11-05 20:00:44
猪鼻插大葱xx,保密,更倾向赞同张捷的观点【【张捷杂谈】阿里复赛结果的宽容与潜规则-哔哩哔哩】 https://b23.tv/PbkCUoe,,一级评论,5,0,2024-11-05 19:59:41
陌上花开栀子,男,央视网的视频还在吗,,一级评论,6,0,2024-11-05 19:57:03
爱丽丝卡塔雷特我之嫁,保密,能把塔蒙在鼓里的势力我只能竖大拇指,陌上花开栀子,二级评论,2,1,2024-11-05 20:00:37
我叫孙烎旺,保密,回复 @爱丽丝卡塔雷特我之嫁 : 塔是以为找到了一个专本平等的典型,陌上花开栀子,二级评论,6,0,2024-11-05 22:47:34
小真真诩,保密,回复 @我叫孙烎旺 : 低学历男（真实力、真热爱）的组合没火。高男、高女也没火，就低女火了,陌上花开栀子,二级评论,6,1,2024-11-05 23:18:49
紫竹山风,保密,阿里系某些人搞事呗,,一级评论,5,0,2024-11-05 19:50:24
巧马,保密,强烈反对人大重阳丁刚的观点！我只是个初中生！但也看到丁刚想传递的信息！这个世界还是西方在主导，中国最好容入西方而放弃大俄才明智！但容入西方的代价是什么，为什么不说出来？我来说吧：失去主权，失去自主发展的权利，失去产业升级的机会，失去不结盟国家的信任，失去在发展中国的领导地位，失去俄国廉价能源的供应，只得到西方在短期内停止对华敌对政策和一个大号日本的地位！从此让西方主宰中华民族的命运，我相信北京没有这么蠢！尽管面临西方的围堵和打压！任何大国崛起都不可能不经历困难与磨练就水到渠成！,,一级评论,5,0,2024-11-05 19:47:05
爱丽丝卡塔雷特我之嫁,保密,自主就是了，依靠谁或者bx内部都是fd的,巧马,二级评论,2,0,2024-11-05 19:53:02
重金寻失散多年的ID,男,当时刚有消息我就信了，天才确实少，但也不是没有啊。而且数学不会就是不会，等正式比赛成绩下来就能说明一切。网上吵来吵去，最后还是要等前两天成绩公布才有定论。,,一级评论,6,0,2024-11-05 19:34:38
运气好点儿耶,保密,她确实有错但也别网暴人家了，因为换我面对这些舆论我肯定紫砂，虽然我是本科生哈[呆],,一级评论,5,0,2024-11-05 19:17:24
我的狗子叫小小,男,有没有可能就是转移注意力，当时有没有其他的时而发生？,,一级评论,5,0,2024-11-05 19:04:53
坚果不系土豆,女,"当时我看着热搜的时候，我就觉得，要是她数学很好，那就很好呗。仅此而已了。
什么天才不天才的，都是自媒体的捧杀。
另外，up说到自媒体在没有调查的情况下怎么怎么的。
唉，现在的媒体，谁还回去调查，都只会“我不禁要问”，全是这现在。",,一级评论,5,0,2024-11-05 18:57:27
太叔真羽,保密,现在中国的教育可能埋没音乐天才，绘画天才，足球天才，唯独不可能埋没数学天才,,一级评论,5,0,2024-11-05 18:44:47
gnailnix,保密,谁都有可能背叛你，但是数学不会，因为数学不会就是不会[笑哭],,一级评论,6,0,2024-11-05 18:28:33
路过的次元破坏者,男,华尔街之狼处处有，只不过他们选择的不是炒股，而是炒流量[吃瓜],,一级评论,6,0,2024-11-05 18:27:23
路过的次元破坏者,男,好一个烽火戏诸侯[捂脸],,一级评论,6,0,2024-11-05 18:21:33
大魏曹子孝,保密,你说偏科高考能考个高分很正常 你在这种级别比赛上顶尖 怎么可能 天赋不可能够 举个例子 普通人突然能打nba 能踢英超,,一级评论,5,0,2024-11-05 18:15:55
沙东乌昂钕士,保密,莫名其妙的新闻，莫名其妙的反转，从始至终没关注过[笑哭],,一级评论,6,0,2024-11-05 18:10:42
我的leona希顿,保密,请最大限度相信自己的直觉。,,一级评论,6,0,2024-11-05 17:57:02
为什么比是什么更重要,保密,说话要严谨。通报里只说她的老师帮助了她，但是并没有提到这种帮助到底产生了多大效果。谁能保证预赛里其他选手就没有接受帮助，只是没有她这么受关注而已。到目前为止没有任何信息说姜萍犯了什么错，所以很可能这个帮助的作用并没有多大。这次的事儿就是一个普通的违规，而这种违规在我们的社会里普遍存在。就好像闯红灯一样，严格来说确实违法了，但是有几个人没闯过红灯呢？,,一级评论,5,0,2024-11-05 17:52:59
南吕庚辰,保密,"第一 姜萍数学符号都抄不对
第二 姜萍数学月考不及格
第三 竞赛是用LaTeX作答，而姜萍连电脑都没有。
竞赛题压根就不是她做的",为什么比是什么更重要,二级评论,6,1,2024-11-05 20:20:32
