用户昵称,性别,评论内容,被回复用户,评论层级,用户当前等级,点赞数量,回复时间
杞人安然泡影依旧,男,我也是，我初中数学就不好，高中直接从年级前几掉在年级末尾（理科也寄），最后还是选了文科，然后题目大改高考只考了56分上了个普通二本[笑哭]，我真是恨透数学了，但是我依然很羡慕和尊敬数学好的人和他们那种数学思维，文科题说难也难说简单也简单，学得再好也不过是获得＋1+1+1～99分，数学和理科题目（物化）学得好可以直接得100分，所以这个天才数学少女在中专我是绝对不会信的[呆],滑跪的项链,二级评论,5,1,2024-11-07 16:49:44
Ary-You,保密,这事刚出的那会儿我就对这件事抱有极大的怀疑态度，不因为别的，就因为我是搞竞赛的。首先，姜萍作为高中生不去参加最权威的全国中学生数学竞赛，而去参加阿里巴巴这种非官方赛事，就已经很值得怀疑了。数学这种需要极强知识整合能力的学科，几乎不可能是一个只能考中专的学生能学通的。举个例子，一个cmo银牌，全国三百名左右的水平，大概率在小学就展现出了极强的天赋，在各个时期都是班级中的绝对强者，然后免中考直升高中，并且大量刷题，经常去全国各地的集训营训练，砸不少于十万块钱，数学成绩在重高也能霸占榜首，并且进入全省前二十，这才有可能达到银牌水平。你要说姜萍一个中专生仅仅靠自己视频中所说的努力就达到这种成就，我不会说不可能，只能说太微乎其微了，不如说她如果真的成功了，那就几乎可以称得上对我们这些竞赛生的侮辱了。,,一级评论,6,5,2024-11-06 00:02:41
烂洞King,男,我专升本的，数学会就会，不会就是不会，再有天赋也不可能达到吹姜平那个水平，而且头大，我已经在想怎么不挂科了[脸红][脸红][脸红],,一级评论,6,6,2024-11-06 00:31:34
烂洞King,男,对了，我中专升大专再升的本科，现在备考四级，零基础，有掌握学习方法的可以教教我，我真的很笨很笨我感觉，在学习这块[脸红][脸红][脸红],烂洞King,二级评论,6,2,2024-11-06 00:32:40
sjcbbb,女,数学真的是不会，学也不会（专指我自己）[笑哭],,一级评论,6,3,2024-11-05 19:40:44
夏末__凉城,保密,样式今天已经暗示了，过几天应该就要限制这个话题了,,一级评论,5,6,2024-11-05 17:03:13
夏末__凉城,保密,1,夏末__凉城,二级评论,5,0,2024-11-05 17:03:31
乐观い,女,[辣眼睛]我当时认识个数学天才，初中的时候就走了竞赛，后来进钱学森班了,,一级评论,6,3,2024-11-06 08:45:05
硬币存够百万再投币,保密,虽然我数学不咋地，但是我看见有爆料说这个女孩大专还只考80分时，我就觉得很违和很矛盾。见识过数学有天赋的小孩，觉得不太可能以前一直不会，忽然间又会了的。,,一级评论,5,7,2024-11-05 20:41:57
我妈三天没打我了-,女,是中专，不是大专[doge],硬币存够百万再投币,二级评论,6,1,2024-11-05 20:43:58
羽临风,保密,如果给我流量，我敢把自己包装成艺术小能手，但是理科，尤其是数学，不会就是不会,,一级评论,6,3,2024-11-05 16:54:51
怡口莲魔王大人,保密,"阿里通告就是甩锅欺负弱者，为什么拖了三个月才定性为交流，没有认定作弊，是不是没有确切的证据证明姜同学作弊，或者说是不是初赛“交流”的人很多，怕一查到底伤了名校学子的面子。既然阿里初赛规则就是这么定，那人家姜同学和王老师合理利用规则也没问题呀，别什么小学生竞赛打代理人战争可以，姜同学交流一下就不行了。况且王老师的名次不过100多名，怎么替姜同学作弊，如果真的和网上说的有一批王老师的朋友们替姜同学做题，那王老师怎么会就在一个中专教学呢，大家了解过高考，大学研究生，肯定知道作弊或者学术不端的严重性，是什么样的人格魅力让一群人自愿承担风险去给王老师作弊，还是说一群高材生对此已经习以为常了，不过是举手之劳，那叫什么作弊。
那这个通告只能证明两种情况，一种可能姜同学天赋确实不错，指导几个月，考试时交流交流就可以能做题了。二种可能在几个月的博弈中，最终选择了背景单薄的姜同学作为阿里赛的遮羞布来供大家批判。就姜同学的笔记来看，或许是后者。（个人看法）",,一级评论,5,5,2024-11-06 00:08:19
猿鸡术,男,我不相信，不应该啊。她一度是我学习的榜样，我真的接受不了。这是有人故意抹黑吧。,,一级评论,5,5,2024-11-05 16:46:52
龙蝎宇,男,是不是忘了加狗头,猿鸡术,二级评论,5,12,2024-11-05 17:08:49
爱国的粉红心,保密,是故意抹黑，我永远相信姜,猿鸡术,二级评论,3,1,2024-11-07 10:01:32
DemonSatan,男,梦该醒了[吃瓜],猿鸡术,二级评论,5,2,2024-11-13 00:42:49
蹲起卡你爆头线,保密,榜  样,猿鸡术,二级评论,2,1,2024-11-22 08:11:01
威尔逊爱的华尔兹,男,相信主,猿鸡术,二级评论,6,1,2024-12-03 04:05:05
年度大冤种丶,保密,数学，天才，中专，这三个只能得到其中两个。,,一级评论,5,4,2024-11-07 13:03:52
南京梁潇0512,保密,不可能三角？[吃瓜][吃瓜],年度大冤种丶,二级评论,4,0,2024-11-07 13:57:55
无名大汉,保密,"《不以学历论英雄，愿更多的“姜萍”散发光彩》
2024-06-17 09:34:42 来源：光明网
　　“毫无疑问，姜萍是有天赋的。但是，正如她自己所说，“要是不努力的话，你光有兴趣的话，这也是没有什么用的”。她能取得如此优异的成绩，最重要的还是源于她持之以恒的努力。学服装设计的她，只能用业余时间自学数学，但她从没放弃。在老师的指导下，她不断钻研，从《高等数学》《数学分析》，学到外语版《偏微分方程》。

　　“天赋+努力”让姜萍这位中专在读生一举成为红透网络的“天才少女”。姜萍的故事让人们看到，过去被人们忽视甚至看轻的中专等学校里也藏龙卧虎，有着许多有才华的年轻人，他们若能够在某个领域施展所长，就会散发出令人瞩目的光芒。

　　姜萍的光芒被人看见，有其幸运之处。首先是她遇到了一位数学老师，他很快发现了姜萍的数学特长，也带领她进入高等数学的天地。正是因为他的鼓励，一度觉得自己“不配”的姜萍才下决心参赛，也才有了今天的一鸣惊人。

　　有人从他们的故事中联想到了电影《心灵捕手》，认为这位数学老师发现姜萍，就像电影里蓝勃教授发现了威尔的数学天赋一样。无论这种对比是否确切，其无疑都是一个伯乐遇到千里马的故事，人们喜闻乐见。

　　然而在现实中，我们对人才的认定却有许多预设的条条框框，这样不设门槛、不带偏见地评价一个人的机会并不常见。比如，很常见的情况是，在招聘过程中，学历常常成为一个硬杠杠，有些单位不仅要求应聘者有本科或研究生学历，甚至还要求他们出自985或211名校，仿佛只要不出自名校，就不可能胜任工作。

　　现在，许多热心网友呼吁清华北大等名校破格录取姜萍。这一方面反映了人们对人才的爱惜，但另一方面也暗示着一个尴尬的事实：即使是像姜萍这样有才华的年轻人，如果没有一个好的学历的话，也很容易被埋没。

　　姜萍是幸运的，她凭借自己的努力找到了展现才华的舞台，但是，还有更多有潜力的年轻人，他们或许并不是传统意义上的“优秀学生”，但也有着各自的闪光点，渴望自己能在某个领域一展所长。

　　期待社会消除学历歧视，减少“名校滤镜”，以更开放的心态给年轻人以更多元化、更个性化的机会。不拘一格育人才，不以学历论英雄，只凭能力较短长，那么，更多的“千里马”必将踊跃奔腾，大放光彩。”",,一级评论,6,4,2024-11-05 20:09:53
无名大汉,保密,浙大当时被骂疯了[少女乐团派对_感想],无名大汉,二级评论,6,0,2024-11-05 20:10:24
爱丽丝卡塔雷特我之嫁,保密,把塔玩了又玩，我只能说厉害[抠鼻],无名大汉,二级评论,2,0,2024-11-05 20:11:23
江南第一燕_,男,回复 @爱丽丝卡塔雷特我之嫁 :塔需要宣传中考五五分流,无名大汉,二级评论,5,0,2024-11-07 17:10:40
酸酸帅浅梦,保密,"从采访完回来的姜萍同学，全然不顾身体的疲惫，连夜拉着我们中专的老师学生讨论偏微分方程的事宜。谈得晚了，便送我们回宿舍，让我们回寝室休息。再去教室的路上，我们说：“姜萍同学，您回去休息吧。您刚接受完采访。”
姜萍说：“不碍事。你们知道，现在学界很多人把我当作靠他人指点的作弊者，不断质疑要我自证实力。你们是反应试教育的未来，你们的事就是中专生和大专生的事情，是头等大事。”
我们都激动了，眼里裹着泪花。多有松弛感的同学呀！
姜萍同学看着天空，说：“如果学界能像这片天空一样干净就好了！但是就有一些人，比如北大清华的一些教授，还有许多985的学生，要搞乱这学界。他们是罪人”说着，姜萍同学便拿着粉笔，在黑板上开始板书。不一会儿，就看到黑板上出现了如“Σ=1/2”“pi*z=pi^z”“主=6”的式子。
“这是我提出并证明的恒等式，学界一直没有对此重视，我已经忍学界很久了。”姜萍同学愤愤的说。我们都鼓起掌来，为我国有这样的学生而自豪。
一会儿姜萍同学叫来了王润秋老师，问：“那个宣传视频过审了吗？”“已经公开了。好像引起了网络上的轰动。”老师回答说。姜萍同学一怔，说：“赶紧去看网络，看有没有什么负面评价。”
之后，姜萍同学送我们回到了宿舍，一直挥手直到看不见我们。
过了几天，我们听说姜萍同学的宣传视频出事了，我们很紧张。这时候姜萍同学叫我们过去。她依旧那样和蔼，让我们坐下，说：“我的几个恒等式是精妙无比的，为之付出是伟大的。”她这是低下头说：“但我必须承认，我在宣传视频里的板书太鲁莽了。我在这儿像全校师生道歉，我将向全涟水县说明情况。”
我们顿时热泪盈眶。多好的同学啊！她在和黑子们斗争的过程中犯下的一点小失误，竟然被她记在心里，还道了歉。我们在将来的学习中，一定要向姜萍同学学习，学她那对学问的刻苦追求与不耻下问的精神。",,一级评论,3,22,2024-11-07 00:25:22
熵增混乱,保密,不是开玩笑，这下真的得完蛋，以后出社会连工作都不好找了,,一级评论,5,9,2024-11-24 16:54:41
特困生早柚,保密,当网红呗[doge]这告诉我们不要打肿脸充胖子,熵增混乱,二级评论,5,2,2024-11-24 17:03:03
斯呆琳,女,开直播有的是傻子给钱,熵增混乱,二级评论,6,6,2024-11-27 10:51:59
--牛-马--,保密,无所谓，反正中专实习毕业也都是发配电子厂,熵增混乱,二级评论,5,1,2024-11-27 16:48:07
锤子需要爆爆,男,回复 @特困生早柚 :得了吧，这种人唯一的用途就是进孙吧被鼠鼠狠狠嘲笑,熵增混乱,二级评论,6,0,2024-11-27 18:12:21
卿Sparrow,男,中专还能找什么好工作,熵增混乱,二级评论,6,0,2024-11-27 19:41:06
不将就117,男,回复 @--牛-马-- :电子厂都不见的进得去,熵增混乱,二级评论,5,0,2024-11-28 18:42:17
特困生早柚,保密,回复 @卿Sparrow :之前还听说她读中专是因为家境还是兴趣，也有说是因为有朋友跟着去读[思考]以后靠脸去开个直播，热度这么高黑红也是红，肯定有傻子打钱,熵增混乱,二级评论,5,2,2024-12-01 11:20:18
l木木木木木偶l,保密,想多了，社会那么大不认识的人多了去了，现在有个沙人饭在你面前你认识不,熵增混乱,二级评论,6,0,2024-12-03 09:17:42
牢斑肘击转生解,保密,可以直播[笑哭],熵增混乱,二级评论,4,0,2024-12-04 07:18:19
黑水-建业,男,与其宣传这种中专“天才”，还不如多挖掘一点中专里面想改变命运的“耐熬王”，这样才能更好的激励中专学生,,一级评论,4,19,2024-11-06 22:42:09
子初Dstrue,保密,大家一开始就都知道，姜同学在这个比赛里和中科院的猫，北大的狗没有区别，但非要有人把她炒起来。那为什么有人炒她不炒中科院的猫北大的狗呢？因为傻子不信啊。,,一级评论,6,3,2024-11-05 16:15:10
在下乙安,女,第一次看到新闻就不太相信，哪怕其他科成绩再差，数学能在这样的赛事上得到12名的话，我实在不相信她会去一个中专。后来她的板书错误、考试成绩等等证据越来越多，更是看笑话看热闹了。,,一级评论,6,7,2024-11-05 16:37:30
剑道如夜夜,保密,现在还有一个疑问，姜萍实际数学水平是什么样的，这个老师帮助是什么程度。,,一级评论,5,7,2024-11-08 14:16:23
云顶口苗口米,保密,真实数学水平不已经知道了？姜萍的学校早就发通知说了姜萍中专水平月考只有90多分，就一初中生水平,剑道如夜夜,二级评论,5,2,2024-11-08 15:18:47
作业西施,保密,不及大部分初二初三生吧，她z能抄成主感觉连基本的数学常识也没有，不过也能理解，真有点脑子的也不会在这种大比赛里搞这种漏洞百出的作秀了,剑道如夜夜,二级评论,5,1,2024-11-08 20:26:05
见证生物多样性捏,保密,应该也是不差的，咋说也是学过的，怎么的也有个普通人水平吧,剑道如夜夜,二级评论,4,0,2024-11-08 20:33:24
HumanLogan,保密,回复 @作业西施 :是∑罢,剑道如夜夜,二级评论,4,0,2024-11-08 21:01:21
MASTUOHKE,保密,回复 @见证生物多样性捏 :自己去搜试卷,剑道如夜夜,二级评论,5,0,2024-11-08 21:08:06
作业西施,保密,回复 @HumanLogan :我记得不是手写体z上边一个点吗，然后她抄成主了,剑道如夜夜,二级评论,5,1,2024-11-09 10:02:19
毛玉・咕・斯米尔诺夫,保密,回复 @见证生物多样性捏 : 如果你说普通人是不及格的水平，那就没错,剑道如夜夜,二级评论,6,1,2024-11-09 10:58:13
HumanLogan,保密,回复 @作业西施 :那我记错了[脱单doge]，总之现在六神无主了[妙啊],剑道如夜夜,二级评论,4,1,2024-11-09 12:29:33
圣女大人塞西莉娅,男,回复 @见证生物多样性捏 :你只要见过他们中考和期中考试的卷子 你对她的成绩的幻想都会烟消云散,剑道如夜夜,二级评论,6,3,2024-11-09 12:57:16
时间绑不住你,保密,一张巨简单的中专月考数学卷子83分(满分120),剑道如夜夜,二级评论,5,4,2024-11-09 13:38:03
名字不要随便打,保密,一个中专都只能考80几的人，题目完全就是老师写的呗,剑道如夜夜,二级评论,5,1,2024-11-09 19:46:07
肥鯮麻酱,保密,回复 @见证生物多样性捏 :她那张月考卷是初二初三难度，且被涟水教体局证明不及格属实，真实水平相当于初二学生里面学习不那么好的,剑道如夜夜,二级评论,6,1,2024-11-13 16:23:13
风羲院,男,我刚看到就知道是假的，经历过江苏中考沦落到中专的人，呵呵，居然那么多人相信了，我是没想到的,,一级评论,6,3,2024-11-16 21:12:32
兆修鸢-,保密,&#34;我除了吃饭睡觉都在做题👍，平时做的那些作业，我扫一眼👀，我觉得没有什么做的价值🤓👆，我更偏向于做 高 等 数 学 之类的，它会给我带来 探 索 的欲望，我喜欢一步一步证明，得到我想证明的东西👉，无论未来会怎么样，数学这个兴趣爱好一直会持续下去🤓☝️&#34;[doge_金箍],,一级评论,4,3,2024-11-07 16:50:42
云里悟理雾里悟理,保密,“高等数学”就这四个字的解读就太多了[doge]同济版的高数也叫“高等数学”,兆修鸢-,二级评论,5,1,2024-11-07 16:53:09
杀生道人,保密,其实有些遗憾，我们其实真心希望国家能多出个数学天才。,,一级评论,6,5,2024-11-05 18:29:07
哦多阔SAMA,男,可以出，但是义务教育不会欺骗人，义务教育没选出来那她就不是这方面的天才,杀生道人,二级评论,5,5,2024-11-05 18:30:48
想沉迷学习的混子,男,哪怕真有天才谁愿意站出来说自己天才受一堆人烦，有那时间还不如多算几道题,杀生道人,二级评论,6,0,2024-11-07 09:32:18
太辣睿呀,男,遗憾个b，你想出金凤凰非得盯着破鸡窝？不能去人家凤凰窝多看看？,杀生道人,二级评论,5,5,2024-11-07 11:23:43
冰原神秘古龙,保密,有没有可能，那些凭实力得奖的就是天才,杀生道人,二级评论,6,10,2024-11-07 13:49:12
种花家粉红兔,保密,"其实很简单，那些跟着起哄认为数学天才在中专的，非蠢既坏[思考]
但凡学过高数的，能相信中考里掉到中专的学生可以搞定竞赛级别的数学题吗[喜极而泣]",,一级评论,6,8,2024-11-05 17:00:02
很懂事打着玩,保密,这事很多人怪给阿里才是最搞笑的，这事除了又一次证明阿里办事无能还能证明什么？？阿里就是个草台班子，你说阿里不严谨可以，但是说阿里教唆她作弊倒是把她摘干净了，多少有点洗白的意思吧。事是她做的，采访是她侃侃而谈的今天说什么几把不要网暴，还让阿里背锅也是好笑。,,一级评论,5,4,2024-11-07 11:21:37
万法永恒,保密,阿里责任也很大，为了炒作搞那么大热度,很懂事打着玩,二级评论,5,0,2024-11-07 13:38:13
半片雪花_,保密,阿里就是故意的，这个事件阿里博得的流量已经赚的盆满钵满了,很懂事打着玩,二级评论,5,0,2024-11-08 09:43:33
寰宇之逆旅,保密,铺天盖地的营销号没阿里是不可能的，反正那段时间天天jp,很懂事打着玩,二级评论,4,0,2024-11-16 01:33:52
瓶割景久,保密,"阿里前一年也搞过类似的炒作，好像是个快递小哥，就是刻意宣传逆袭来吸引眼球。当然上一位是有真才实学的。
这么搞总有一天会撞到李鬼，只不过撞到的比所有人想象的都早了[吃瓜]",很懂事打着玩,二级评论,6,0,2024-11-20 13:16:23
点亮早起者的希望,保密,回复 @瓶割景久 :因为去年宣传真的不挣钱，送外卖≠学不好,很懂事打着玩,二级评论,3,0,2024-11-22 10:41:00
半睡半醒半醉翁,保密,这不是起哄吗？她的老师既然有那么高的水平，为什么成绩没有同场参加竞赛的学生的成绩好？最后这一场竞赛这个老师参加了吗？成绩如何？,,一级评论,4,3,2024-11-06 19:02:20
Cheery的老父亲,保密,破案了，姜萍和老师提供了帮助😁,半睡半醒半醉翁,二级评论,5,0,2024-11-06 19:03:29
势如破竹n,保密,未得奖呢[无语],半睡半醒半醉翁,二级评论,4,0,2024-11-06 19:10:40
asdfghj4321,保密,"因为初赛根本就没有固定的时间，只要在规定的一段时间之内上传考卷就可以，所以老师可以和姜萍一起参加考试。老师先用自己的账号答题提交了考卷，然后第二遍答题时用姜萍的账号提交答卷，可能是在第二遍答题的过程中，老师发现了自己第一遍答题的错误，或者在自己拿不准的题目上填写了另一种答案，刚好对了。所以姜萍账号的得分比自己的账号要高，排名更加靠前。
之所以这么做是因为，决赛的考试要求在24小时内，任选8小时进行答题，如果有多个自己控制的账号进入决赛，他就可以用其他账号事先看到决赛考题，提前作答或者请求场外援助，最后用自己的账号提交答案。这样就比其他考生多出了8小时答题时间",半睡半醒半醉翁,二级评论,6,0,2024-11-06 20:48:55
cc乘乘,保密,回复 @asdfghj4321 :有疑问，1为什么不先用姜萍的账号看题目最后用自己的账号答题？ 2为什么还要用姜萍的账号答题？难道提交完答案之后马上就能出来分数判断自己答得对不对？3他能这样做其他人就不会吗？其他人就保证没有跟别人讨论吗？ 为什么他能考12名，其他人不可以？不也是一种能力？,半睡半醒半醉翁,二级评论,6,0,2024-11-08 23:43:43
asdfghj4321,保密,"回复 @cc乘乘 : 1、因为预赛的排名没有任何影响，最终的奖项由决赛确定，也就是说哪怕在预赛取得了第一名在决赛考差了也没有奖金，没有荣誉，什么都没有。王某只要保证取得决赛资格即可，所以用先用谁的账号作答没有影响，实际上王某妻子的账号才是最先作答的，排在了300名左右。姜萍引起了注意被炒作完全是一个意外。
2、用多个账号答题是为了决赛做准备而不是预选赛，决赛的规则是在24小时内任选8小时考试。有多个自己控制的账号进入决赛就可以在决赛里用别人的账号先把题目抄出来，然后在登录自己的账号作答之前先求解这些问题甚至场外援助，然后在最后8小时里登录作答，无形中比别人多出16个小时。
3、显而易见的是，别人会这么做，阿里巴巴的考试根本无从杜绝这一现象，毕竟只是个民间比赛，只是这回姜萍闹得比较大而已。而他能考12名是因为显而易见的，王某本人是有一定的实力的，在2022年参加阿里数赛就取得过166名的成绩。本次他虽然排名125名看似和姜萍的12名差了很多，但也只不过是多对一道选择题的差别仅此而已，甚至可能是第二次答题时蒙对的。
其他人没有在预选赛取得好名次的原因在于：（1）和上面说的一样，预选赛排名没有任何意义，决赛取得名次才能获奖，所以很多人并没有在预选赛下多少工夫或者采用“特殊手段”，只需要入围决赛即可。实际上过去，很多预选赛排名靠前的人并没有拿到奖项。（2）民间比赛含金量有限，事实证明尽管王某多次入围阿里数赛决赛，但是这样的履历甚至都不能帮助他获得博士生资格，对于很多大佬来说与其参加这种比赛，不如把时间用在科研论文和官方举办的数学竞赛上对自己更有意义。",半睡半醒半醉翁,二级评论,6,0,2024-11-09 10:03:38
菅直,保密,我是真的相信了，我以为她是上了中专后才喜欢上数学刻苦钻研的，我实在是太天真了,,一级评论,5,3,2024-11-06 08:35:40
68岁在逃帅哥,保密,其他学科不清楚，但数学不会是真的不会[微笑],,一级评论,5,5,2024-11-05 16:26:51
睡不醒的丨小新新,女,"又一次为了制造男女对立搞出来的离谱新闻，集美们集体高潮，自媒体，大媒体，个人博主流量吃饱了，境外资助看到效果了，集美们拿到了攻击话术，受伤的只有被裹挟参赛的姜萍。
现在集美们新的话术又出来了，都怪姜萍背后的男老师，赢麻了[大笑]",,一级评论,5,4,2024-11-06 09:50:42
傅琳ll,保密,有没有可能男女对立也是受害者，真正受益的阿里呢，搞成功了无疑又给资本开了后门…失败了，直接把问题引向男女对立阶级对立上，背后的人美美隐身。,睡不醒的丨小新新,二级评论,4,1,2024-11-06 10:33:59
睡不醒的丨小新新,女,回复 @傅琳ll :男女对立，只有男方是受害者，集美们只要权利不要义务，成功了，她们也是受益方，只不过是受益的韭菜罢了。,睡不醒的丨小新新,二级评论,5,1,2024-11-06 12:13:02
傅琳ll,保密,回复 @若无缘别遇见太疼 :对捞女而言是受益，可是对想拼搏想正常奋斗的女性而言，就和男性一样是受害者…算了，说了你们也不理解，无所谓了,睡不醒的丨小新新,二级评论,4,1,2024-11-06 12:37:25
傅琳ll,保密,回复 @若无缘别遇见太疼 :再者，加强男女对立，对于那些想要用钱换一切的男的而言会受害，可是对那些情绪稳定的正常男性而言，其实是有利的啊，对男性的评价标准不再是单一价值，这不是好事？,睡不醒的丨小新新,二级评论,4,1,2024-11-06 12:39:03
雨瞳u,保密,JP还受害者上了真是搞笑，你情我愿罢了,睡不醒的丨小新新,二级评论,5,0,2024-12-01 16:54:01
睡不醒的丨小新新,女,回复 @雨瞳u :一个十几岁的女生，她有什么能力和实力来反抗我就问问你？你可以说她被名利蒙蔽了，但是她也是受害者，因为她没得选，你十几岁的时候有什么反抗能力？,睡不醒的丨小新新,二级评论,5,0,2024-12-01 19:02:50
让我是的去油去表,保密,只要去掉少女这个词，大部分人都会很理智的去考虑真实性。,,一级评论,6,4,2024-11-05 17:13:25
予以欢颜ボ,保密,还有人不信[喜极而泣][喜极而泣]真要数学天才还能上中专？[喜极而泣],,一级评论,3,3,2024-11-24 11:12:11
绊鸟,保密,BV15ZD8YVEcc,,一级评论,2,2,2024-11-05 17:59:25
我的希望之光,保密,[歪嘴]主要是这样造假的性价比很高啊。,,一级评论,6,4,2024-11-06 03:02:13
北柒生,男,如果贝多芬重生到现在的中国，他可能成为一个普通人，过一生天赋都不会被发掘，但高斯绝对不会,,一级评论,2,4,2024-11-15 23:40:14
